{
  "$schema": "https://json-schema.org/draft/2020-12/schema",
  "title": "skills-sync.json",
  "description": "The committed config of a skills library: the library itself, the third-party repositories it takes skills from (what is taken from each, renames, per-skill pins, attribution), the plugins the library builds, and what every machine takes from it at a release. Hand-edited and written by add; read by skills-sync refresh and build in a checkout, and by sync, status and unlink from the release's commit on GitHub.",
  "type": "object",
  "required": ["version"],
  "additionalProperties": false,
  "properties": {
    "version": {
      "const": 1
    },
    "library": {
      "description": "The library itself, for the catalogs and the registry.",
      "type": "object",
      "additionalProperties": false,
      "properties": {
        "name": {
          "type": "string"
        },
        "owner": {
          "type": "string"
        },
        "homepage": {
          "type": "string"
        },
        "version": {
          "description": "Explicit authored release version shared by every own-skills plugin. Build uses it unchanged; the release workflow owns semantic bumps. No build metadata.",
          "type": "string",
          "pattern": "^(0|[1-9]\\d*)\\.(0|[1-9]\\d*)\\.(0|[1-9]\\d*)$"
        }
      }
    },
    "generate": {
      "description": "The two forms, each behind a switch (both true when absent). skills: generate and link the loose-skill layers. plugins: generate plugins/<id>/ and the two marketplace catalogs. Read by build; parsed and validated here.",
      "type": "object",
      "additionalProperties": false,
      "properties": {
        "skills": {
          "description": "Generate and link the loose-skill layers (default true).",
          "type": "boolean"
        },
        "plugins": {
          "description": "Generate plugins/<id>/ and both marketplace catalogs (default true).",
          "type": "boolean"
        }
      }
    },
    "renderings": {
      "description": "Renderings of the packages for harnesses that cannot load plugins/<id>/ as built, each behind the folder it is written to (relative to the library root, / separators). Absent: none is written and build's output is the packages and catalogs alone. hermes: the Hermes rendering of every package at <folder>/<id>/ (the package without the Claude Code and Codex manifests, each skill's metadata cut to string entries), and a paragraph in every NOTICE.md naming it. Read by build; the machine sync installs from the folder the release's skills-sync.json names here (dist/hermes when it names none).",
      "type": "object",
      "additionalProperties": false,
      "properties": {
        "hermes": {
          "description": "Where the Hermes rendering of every package is written, relative to the library root with / separators, such as dist/hermes. The machine sync installs from the folder the release's skills-sync.json names here, and from dist/hermes when it names none.",
          "type": "string",
          "pattern": "^[a-z0-9_-][a-z0-9._-]*(/[a-z0-9_-][a-z0-9._-]*)*$"
        }
      }
    },
    "sources": {
      "description": "One entry per source id; the id names the snapshot folder upstream/<id> and the plugin built from it.",
      "type": "object",
      "additionalProperties": false,
      "patternProperties": {
        "^[a-z0-9][a-z0-9-]*$": {
          "$ref": "#/$defs/source"
        }
      }
    },
    "plugins": {
      "description": "One entry per plugin id: an own-skills group or a source.",
      "type": "object",
      "additionalProperties": false,
      "patternProperties": {
        "^[a-z0-9][a-z0-9-]*$": {
          "$ref": "#/$defs/plugin"
        }
      }
    },
    "machines": {
      "description": "What every machine takes from this file at a release's commit (read from GitHub by the machine commands sync, status and unlink; never from a checkout): which harnesses are served and which plugins each gets. Absent, every detected harness gets every plugin the release ships.",
      "type": "object",
      "additionalProperties": false,
      "properties": {
        "harnesses": {
          "description": "Harness ids the machine commands serve (claude-code, codex, hermes); every detected one when absent.",
          "type": "array",
          "items": {
            "type": "string",
            "minLength": 1
          },
          "uniqueItems": true
        },
        "plugins": {
          "description": "Per harness id, or \"*\" for every harness not named, the plugin ids a machine installs from the release; a harness named nowhere gets every one.",
          "type": "object",
          "additionalProperties": false,
          "patternProperties": {
            "^(\\*|[a-z0-9][a-z0-9-]*)$": {
              "type": "array",
              "items": {
                "type": "string",
                "minLength": 1
              },
              "uniqueItems": true
            }
          }
        }
      }
    },
    "releases": {
      "description": "The ChatGPT upload record, one entry per plugin id, written by hand after each upload (the library's docs/agents/chatgpt-upload.md). Read by build --artifacts to say whether an archive changed since its last upload.",
      "type": "object",
      "additionalProperties": false,
      "patternProperties": {
        "^[a-z0-9][a-z0-9-]*$": {
          "$ref": "#/$defs/release"
        }
      }
    }
  },
  "$defs": {
    "release": {
      "type": "object",
      "required": ["plugin_id", "release_id", "sha256", "scope", "date"],
      "additionalProperties": false,
      "properties": {
        "plugin_id": {
          "description": "The plugin id ChatGPT returned on create.",
          "type": "string",
          "minLength": 1
        },
        "release_id": {
          "description": "The release id ChatGPT returned on the last create or update; an update must name it.",
          "type": "string",
          "minLength": 1
        },
        "sha256": {
          "description": "The sha256 of the archive that was uploaded, from artifacts/releases.json.",
          "type": "string",
          "pattern": "^[0-9a-f]{64}$"
        },
        "scope": {
          "description": "Where the plugin lives in ChatGPT: a personal plugin, or a workspace one.",
          "enum": ["personal", "workspace"]
        },
        "date": {
          "description": "The day of the upload, YYYY-MM-DD.",
          "type": "string",
          "pattern": "^\\d{4}-\\d{2}-\\d{2}"
        },
        "files": {
          "description": "The archive's entries at that upload, so a later build can say which files a new archive lacks (an update cannot delete).",
          "type": "array",
          "items": {
            "type": "string",
            "minLength": 1
          },
          "uniqueItems": true
        }
      }
    },
    "name": {
      "type": "string",
      "pattern": "^[A-Za-z0-9][A-Za-z0-9._-]*$"
    },
    "commit": {
      "type": "string",
      "pattern": "^[0-9a-f]{40}$"
    },
    "source": {
      "type": "object",
      "required": ["repo", "ref", "skills"],
      "additionalProperties": false,
      "properties": {
        "repo": {
          "description": "owner/repo on GitHub, a git URL, or a local path.",
          "type": "string",
          "minLength": 1
        },
        "ref": {
          "description": "The branch or tag followed: every refresh takes its tip, except skills held by a pin. A full commit holds the whole source.",
          "type": "string",
          "minLength": 1
        },
        "version": {
          "description": "The upstream version the source is held at, plain semver (1.3.0, never v1.3.0): update takes the commit of that release tag, or for a source versioned by its manifest the newest commit carrying that version. Latest when omitted. skills-sync never writes it; update --to prints the change to land.",
          "type": "string",
          "pattern": "^\\d+\\.\\d+\\.\\d+(-[0-9A-Za-z.-]+)?(\\+[0-9A-Za-z.-]+)?$"
        },
        "root": {
          "description": "Where skill folders live in the repo (skills, pstack/skills); the repo root when omitted.",
          "type": "string"
        },
        "skills": {
          "description": "Selected skill folder names: a list, or a map from upstream name to working-set name for renames.",
          "oneOf": [
            {
              "type": "array",
              "items": {
                "$ref": "#/$defs/name"
              },
              "uniqueItems": true
            },
            {
              "type": "object",
              "additionalProperties": false,
              "patternProperties": {
                "^[A-Za-z0-9][A-Za-z0-9._-]*$": {
                  "$ref": "#/$defs/name"
                }
              }
            }
          ]
        },
        "pins": {
          "description": "Per-skill commits (by upstream folder name) that hold a skill while its siblings follow ref; edit the commit to move it.",
          "type": "object",
          "additionalProperties": false,
          "patternProperties": {
            "^[A-Za-z0-9][A-Za-z0-9._-]*$": {
              "$ref": "#/$defs/commit"
            }
          }
        },
        "attribution": {
          "description": "Files copied into the snapshot and every package built from it (LICENSE, README), as upstream paths.",
          "type": "array",
          "items": {
            "type": "string",
            "minLength": 1
          },
          "uniqueItems": true
        }
      }
    },
    "plugin": {
      "type": "object",
      "required": ["displayName"],
      "additionalProperties": false,
      "properties": {
        "displayName": {
          "type": "string",
          "minLength": 1
        },
        "description": {
          "type": "string"
        },
        "group": {
          "description": "The own-skills group under skills/ this plugin packages.",
          "$ref": "#/$defs/name"
        },
        "source": {
          "description": "The source id this plugin packages.",
          "type": "string",
          "pattern": "^[a-z0-9][a-z0-9-]*$"
        }
      },
      "oneOf": [
        {
          "required": ["group"]
        },
        {
          "required": ["source"]
        }
      ]
    }
  }
}
