{
  "version": 1,
  "library": {
    "name": "skills",
    "owner": "oneezy",
    "homepage": "https://github.com/oneezy/skills",
    "version": "0.50.3"
  },
  "generate": {
    "skills": true,
    "plugins": true
  },
  "renderings": {
    "hermes": "dist/hermes"
  },
  "sources": {
    "matt-pocock": {
      "repo": "mattpocock/skills",
      "ref": "main",
      "root": "skills",
      "skills": [
        "ask-matt",
        "chief-of-staff",
        "claude-handoff",
        "code-review",
        "codebase-design",
        "diagnosing-bugs",
        "domain-modeling",
        "git-guardrails-claude-code",
        "grill-me",
        "grill-with-docs",
        "grilling",
        "handoff",
        "implement",
        "implement-spec",
        "improve-codebase-architecture",
        "loop-me",
        "migrate-to-shoehorn",
        "pr",
        "prototype",
        "research",
        "retro",
        "scaffold-exercises",
        "setup-matt-pocock-skills",
        "setup-pre-commit",
        "setup-ts-deep-modules",
        "tdd",
        "teach",
        "to-questionnaire",
        "to-spec",
        "to-tickets",
        "triage",
        "wait-what",
        "wayfinder",
        "wizard",
        "writing-beats",
        "writing-for-agents",
        "writing-fragments",
        "writing-shape"
      ],
      "pins": {
        "writing-for-agents": "321658273cb1d20b76026717d027d505790106d4"
      },
      "attribution": [
        "LICENSE",
        "README.md"
      ]
    },
    "pstack": {
      "repo": "cursor/plugins",
      "ref": "main",
      "root": "pstack/skills",
      "skills": "*",
      "rename": {
        "tdd": "pstack-tdd",
        "teach": "pstack-teach"
      },
      "pins": {},
      "attribution": [
        "pstack/LICENSE",
        "pstack/README.md"
      ],
      "adapt": {
        "rules": [
          {
            "find": "writes an always-applied rule that overrides",
            "replace": "writes a settings file that overrides"
          },
          {
            "find": "`~/\\.cursor/rules/pstack-models\\.mdc`, an always-applied rule that sets",
            "replace": "the pstack settings file (`~/.agents/pstack-models.md`), which sets"
          },
          {
            "find": "Write `~/\\.cursor/rules/pstack-models\\.mdc` with `alwaysApply: true`, a",
            "replace": "Write the pstack settings file (`~/.agents/pstack-models.md`) with a"
          },
          {
            "find": "```\\n---\\ndescription: pstack per-role model choices \\(overrides skill defaults\\)\\nalwaysApply: true\\n---\\n",
            "replace": "```\n"
          },
          {
            "find": "No `~/\\.cursor/rules/pstack-models\\.mdc` means",
            "replace": "No `~/.agents/pstack-models.md` means"
          },
          {
            "find": "`~/\\.cursor/rules/pstack-models\\.mdc`",
            "replace": "the pstack settings file (`~/.agents/pstack-models.md`)"
          },
          {
            "find": "the `pstack-models\\.mdc` rule",
            "replace": "the pstack settings file (`~/.agents/pstack-models.md`)"
          },
          {
            "find": "the `/setup-pstack` rule",
            "replace": "the pstack settings file (`~/.agents/pstack-models.md`)"
          },
          {
            "find": "\\b([Ii]f) the rule or (that|the) line is missing",
            "replace": "$1 the file or $2 line is missing"
          },
          {
            "find": "the model rule is missing",
            "replace": "the settings file is missing"
          },
          {
            "find": "the rule shape shown in step 5",
            "replace": "the file shape shown in step 5"
          },
          {
            "find": "when the rule records one\\. With no rule,",
            "replace": "when the file records one. With no file,"
          },
          {
            "find": "### 5\\. Write the rule",
            "replace": "### 5. Write the file"
          },
          {
            "find": "Tell the user the rule was written and that it applies to new sessions\\.",
            "replace": "Tell the user the file was written and that pstack skills read it when they pick a model."
          },
          {
            "find": "and writes a rule\\. The rule applies to new chats\\.",
            "replace": "and writes the pstack settings file (`~/.agents/pstack-models.md`), which pstack skills read when they pick a model."
          },
          {
            "find": "If Cursor also exposes a models API or CLI",
            "replace": "If your harness also has a models API or CLI"
          },
          {
            "find": "(default to one each on|choose from) `claude-opus-5-5-xhigh` and `grok-4\\.7-xhigh-fast`\\.",
            "replace": "$1 `claude-opus-5-5-xhigh` and `grok-4.7-xhigh-fast`, or the closest models your harness has."
          },
          {
            "find": "Spawn `Task` with `subagent_type: \\\"Comment Sicko\\\"`\\.",
            "replace": "Spawn the Comment Sicko subagent. Where your harness has no subagent by that name, spawn a general one that first reads pstack's [`agents/comment-sicko.md`](https://github.com/cursor/plugins/blob/main/pstack/agents/comment-sicko.md)."
          },
          {
            "find": "\\*\\*Use `subagent_type: \\\"poteto-agent\\\"` for any subagent you spawn inside a playbook step\\*\\* \\(code-writing delegates, ad-hoc helpers\\)\\.",
            "replace": "**Use the `poteto-agent` subagent for any subagent you spawn inside a playbook step** (code-writing delegates, ad-hoc helpers). Where your harness has no subagent by that name, spawn a general one that first reads the poteto-mode skill in full."
          },
          {
            "find": "with `subagent_type: \\\"poteto-agent\\\"`",
            "replace": "as the `poteto-agent` subagent"
          },
          {
            "find": "set their own `subagent_type`",
            "replace": "set their own subagent type"
          },
          {
            "find": "Every spawn is a Task subagent with `subagent_type: generalPurpose` and",
            "replace": "Every spawn is a general-purpose subagent with"
          },
          {
            "find": "`Task` (calls?), `subagent_type: generalPurpose`,",
            "replace": "general-purpose subagent $1,"
          },
          {
            "find": "gets `subagent_type: generalPurpose`, `readonly: true`, and",
            "replace": "is a general-purpose subagent with `readonly: true` and"
          },
          {
            "find": "with `subagent_type: generalPurpose`, ",
            "replace": "as general-purpose subagents with "
          },
          {
            "find": "Every spawn is `generalPurpose` with",
            "replace": "Every spawn is a general-purpose subagent with"
          },
          {
            "find": "\\bthe (?:`Task`|Task) tool\\b",
            "replace": "your subagent tool"
          },
          {
            "find": "`Task` (calls?|prompt)",
            "replace": "subagent $1"
          },
          {
            "find": "in the `Task` response body",
            "replace": "in the subagent's response"
          },
          {
            "find": "a `Task` subagent",
            "replace": "a subagent"
          },
          {
            "find": "\\(omit Task `model`\\)",
            "replace": "(omit the subagent's `model`)"
          },
          {
            "find": "About to `AskQuestion` on",
            "replace": "About to ask the user about"
          },
          {
            "find": "the `AskQuestion` tool",
            "replace": "your question tool"
          },
          {
            "find": "`AskQuestion`|\\bAskQuestion\\b",
            "replace": "your question tool"
          },
          {
            "find": "the \\*\\*create-skill\\*\\* skill \\(Cursor's built-in for authoring SKILL\\.md files\\)",
            "replace": "your skill-authoring skill"
          },
          {
            "find": "Cursor's built-in `create-skill` skill",
            "replace": "your skill-authoring skill"
          },
          {
            "find": "Cursor's built-in `create-skill` \\(authoring\\)",
            "replace": "your skill-authoring skill"
          },
          {
            "find": "via create-skill \\+ unslop",
            "replace": "via your skill-authoring skill and unslop"
          },
          {
            "find": "new skill via create-skill",
            "replace": "new skill"
          },
          {
            "find": "A `create-skill`-style test/iterate benchmark loop",
            "replace": "A test/iterate benchmark loop like your skill-authoring skill's"
          },
          {
            "find": "`create-skill`'s",
            "replace": "your skill-authoring skill's"
          },
          {
            "find": "- `/loop` and `/create-skill` are Cursor built-ins\\.",
            "replace": "- `/loop` (or your harness's scheduler) and a skill-authoring skill come with your harness."
          },
          {
            "find": "`create-skill` alone",
            "replace": "Your skill-authoring skill alone"
          },
          {
            "find": "`create-skill`",
            "replace": "your skill-authoring skill"
          },
          {
            "find": "the `deslop` skill from the `cursor-team-kit` plugin \\(`/deslop`\\)",
            "replace": "the `deslop` skill, `/deslop`, when installed"
          },
          {
            "find": "`cursor-team-kit` publishes `control-cli`",
            "replace": "The control skills are `control-cli`"
          },
          {
            "find": "\\(browser / Electron / web UIs\\)\\. For bug fixes",
            "replace": "(browser / Electron / web UIs), when installed. For bug fixes"
          },
          {
            "find": "- `/deslop`, `control-cli`, and `control-ui` ship in the `cursor-team-kit` plugin\\.",